{"title":"Open Household Records Taxonomy","short_name":"OHRT","namespace":"ohrt","version":"0.1.0","status":"released","maintainer":"Eterna Clarity","license":null,"classification_principle":"Assign each record one primary category based on the household context that most naturally owns its ongoing meaning. Preserve other relevant contexts as relationships, tags, or references rather than competing primary copies.","retrieval_test":"If this record disappeared, which part of household life would notice first?","sensitivity_levels":{"context_dependent":"Sensitivity varies substantially with the specific record and household context.","often_sensitive":"This family often contains personal, account, location, ownership, or other information that should be handled deliberately.","highly_sensitive":"This family commonly contains identity, health, financial, legal, child, or similarly consequential personal information."},"categories":[{"id":"ohrt.identity_civil_status","slug":"identity-civil-status","name":"Identity & civil status","display_order":10,"definition":"Records that establish identity or significant personal-status facts.","examples":["passport","birth certificate","citizenship or immigration document","marriage or divorce record","name-change record"],"applicability":{"mode":"conditional","when":"Use for identity and civil-status records that actually apply to members of the household."},"sensitivity":{"level":"highly_sensitive","note":"Identity documents can expose information that enables impersonation, account recovery, or other misuse if handled poorly."},"lifecycle":{"review_triggers":["document expiry or renewal","name or civil-status change","document loss, theft, replacement, or cancellation","citizenship or immigration status change"]},"related_categories":["ohrt.legal_estate","ohrt.travel","ohrt.emergency_continuity"]},{"id":"ohrt.home_property","slug":"home-property","name":"Home & property","display_order":20,"definition":"Records connected to owning, renting, inspecting, improving, repairing, or managing a home or other property.","examples":["purchase document","lease","property assessment","inspection report","renovation record","permit","major property service history"],"applicability":{"mode":"conditional","when":"Use when the household owns, rents, occupies, improves, or is otherwise responsible for a property."},"sensitivity":{"level":"often_sensitive","note":"Property records can reveal addresses, ownership, financing, access, condition, or security-related details."},"lifecycle":{"review_triggers":["move, purchase, sale, or new lease","renovation or permitted work","inspection or assessment","major repair or property-system replacement","ownership or occupancy change"]},"related_categories":["ohrt.insurance","ohrt.tax","ohrt.legal_estate","ohrt.financial","ohrt.household_assets_receipts_warranties","ohrt.household_services_utilities"]},{"id":"ohrt.insurance","slug":"insurance","name":"Insurance","display_order":30,"definition":"Policies, renewals, coverage information, claims, proof of insurance, and insurer correspondence across household insurance needs.","examples":["home or tenant policy","vehicle policy","life policy","health or supplemental policy","travel policy","pet insurance policy","claim record","proof of insurance","renewal notice"],"applicability":{"mode":"conditional","when":"Use for insurance products and claims that apply to the household, its people, property, vehicles, travel, or other insured interests."},"sensitivity":{"level":"often_sensitive","note":"Insurance records may contain identifying, financial, health, property, beneficiary, claim, or account information."},"lifecycle":{"review_triggers":["policy renewal","coverage or deductible change","new or closed policy","claim opened or resolved","provider change","major household, property, vehicle, health, or travel change"]},"related_categories":["ohrt.home_property","ohrt.vehicles_transportation","ohrt.health_care","ohrt.travel","ohrt.financial","ohrt.pets"]},{"id":"ohrt.tax","slug":"tax","name":"Tax","display_order":40,"definition":"Returns, assessments, slips, receipts, and supporting records retained or used for tax purposes.","examples":["tax return","notice of assessment or reassessment","income slip","deduction or credit support","tax payment record","tax correspondence"],"applicability":{"mode":"conditional","when":"Use for records whose primary household purpose is tax filing, support, assessment, payment, or correspondence."},"sensitivity":{"level":"highly_sensitive","note":"Tax records commonly combine identity, income, account, address, dependant, and other sensitive personal information."},"lifecycle":{"review_triggers":["new tax year","return filed or amended","assessment or reassessment","supporting record corrected","tax dispute or review","retention requirement reached under the applicable authority"]},"related_categories":["ohrt.financial","ohrt.employment_income","ohrt.home_property","ohrt.legal_estate"]},{"id":"ohrt.legal_estate","slug":"legal-estate","name":"Legal & estate","display_order":50,"definition":"Legal instruments, court records, estate documents, representation documents, consent documents, and other records whose primary purpose is personal legal authority, status, representation, or estate matters rather than another household domain.","examples":["will","power of attorney","personal directive or representation document","court order","estate document","guardianship or custody order","consent document","separation agreement"],"applicability":{"mode":"conditional","when":"Use only for legal or estate records that actually apply to the people and circumstances in the household."},"sensitivity":{"level":"highly_sensitive","note":"These records may affect legal authority, beneficiaries, dependants, property, finances, care, or other consequential rights and responsibilities."},"lifecycle":{"review_triggers":["new, amended, revoked, or replaced instrument","marriage, separation, birth, death, or dependant change","representative, executor, guardian, or beneficiary change","material property or financial change","move to a different legal jurisdiction"]},"related_categories":["ohrt.identity_civil_status","ohrt.financial","ohrt.home_property","ohrt.emergency_continuity","ohrt.education_children","ohrt.travel"]},{"id":"ohrt.emergency_continuity","slug":"emergency-continuity","name":"Emergency & continuity","display_order":60,"definition":"Plans, contacts, accessible reference information, care instructions, and other material intended to help appropriate people act when normal household routines are disrupted.","examples":["emergency plan","emergency contact list","care instruction","evacuation information","important-document location guide","accessible reference copy"],"applicability":{"mode":"conditional","when":"Use for information deliberately prepared for emergency response, temporary incapacity, absence, or household continuity."},"sensitivity":{"level":"often_sensitive","note":"Emergency material may combine contact, health, identity, location, dependant, pet, access, or account-reference information and should expose only what is useful for the intended purpose."},"lifecycle":{"review_triggers":["move or address change","emergency contact change","health, medication, or care change","new or changed dependant","pet-care change","insurance or emergency-plan change","change in who is expected to help"]},"related_categories":["ohrt.identity_civil_status","ohrt.health_care","ohrt.insurance","ohrt.legal_estate","ohrt.education_children","ohrt.pets"]},{"id":"ohrt.financial","slug":"financial","name":"Financial","display_order":70,"definition":"Banking, general borrowing, investments, financing, statements, and other household financial records that do not belong more naturally under a more specific family.","examples":["bank statement","personal loan agreement","line of credit statement","investment statement","account summary","payment schedule"],"applicability":{"mode":"conditional","when":"Use for financial accounts, obligations, assets, and transactions relevant to the household."},"sensitivity":{"level":"highly_sensitive","note":"Financial records can contain account identifiers, balances, transactions, borrowing information, personal identifiers, and other high-impact information."},"lifecycle":{"review_triggers":["account opened or closed","loan or financing change","major payment or payoff","institution change","material investment or pension change","major household financial event"]},"related_categories":["ohrt.tax","ohrt.home_property","ohrt.legal_estate","ohrt.employment_income","ohrt.insurance"]},{"id":"ohrt.vehicles_transportation","slug":"vehicles-transportation","name":"Vehicles & transportation","display_order":80,"definition":"Registration, purchase, financing, inspection, maintenance, service, and other records tied to vehicles or recurring transportation assets.","examples":["vehicle registration","purchase record","financing record","inspection report","service invoice","maintenance history","tire or major-component record"],"applicability":{"mode":"conditional","when":"Use when the household owns, finances, leases, maintains, or is otherwise responsible for a vehicle or recurring transportation asset."},"sensitivity":{"level":"often_sensitive","note":"Vehicle records may contain registration, ownership, financing, address, location, identifier, or insurance information."},"lifecycle":{"review_triggers":["purchase, lease, sale, or disposal","registration or inspection renewal","service or major repair","accident or claim","financing change or payoff","major component or ownership change"]},"related_categories":["ohrt.insurance","ohrt.household_assets_receipts_warranties","ohrt.financial"]},{"id":"ohrt.health_care","slug":"health-care","name":"Health & care","display_order":90,"definition":"Records used to understand, document, or coordinate health, medication,